メルクパテントゲゼルシャフトミットベシュレンクテルハフツング,591032596
モボファイルズインク．ディービーエーモボライズ,514116693
モリックス株式会社,594034625
モルガナ・デ・アビラ・リバス,516197263
モロジック・リミテッド,516122335
ヤグチ電子工業株式会社,513232598
ヤフー株式会社,500257300
ヤマウチ株式会社,000114710
ヤマハ株式会社,000004075
ヤマハ発動機株式会社,000010076
ヤンセンファーマシューティカエヌ．ベー．,397060175
ヤンマー株式会社,000006781
ユー・ディー・シーアイルランドリミテッド,512253626
ユーエフアイフィルターズエッセ．ピ．ア．,511259142
ユーシーエルビジネスピーエルシー,507299817
ユーシステム株式会社,500301784
ユーハ味覚糖株式会社,390020189
ユービーマテリアルズインコーポレイテッド,314004772
ユーロケラソシエテオンノームコレクティフ,504374919
ユーロプラズマエンヴェー,516104870
ユセベファルシムソシエテアノニム,504000041
ユタ−イナディーディーエスアンドアドバンストセラピューティクスリサーチセンター,515129331
ユナイテッドセラピューティクスコーポレイション,511266520
ユニ・チャーム株式会社,000115108
ユニオン電子工業株式会社,591112658
ユニコン電子株式会社,598174129
ユニサンティスエレクトロニクスシンガポールプライベートリミテッド,311014428
ユニスト（ウルサンナショナルインスティテュートオブサイエンスアンドテクノロジー）,515351884
ユニチカ株式会社,000004503
ユニバーサルシティスタジオズリミテッドライアビリティカンパニー,511077292
ユニバーサルディスプレイコーポレイション,503055897
ユニバーサル製缶株式会社,305060154
ユニバーシティ・オブ・チューリッヒ,507324681
ユニバーシティオブワシントンスルーイッツセンターフォーコマーシャライゼーション,513111938
ユニバーシティヘルスネットワーク,514234997
ユニベーション・テクノロジーズ・エルエルシー,599168648
ユニベルシテ・パリ・デカルト,509033033
ユニヴァーシティ・オブ・サウス・オーストラリア,516268220
ユニヴェルシテ・ドゥ・ナント,507421289
ユニヴェルシテ・ドゥ・ナント,510187118
ユニヴェルシテデクス−マルセイユ,511025226
ユリウス・マクシミリアンス−ウニヴェルジテート・ヴュルツブルク,510232393
ヨーベイビーエルエルシー,516243375
ヨハネスグーテンベルグ−ウニヴェリジテートマインツ,509256849
ヨフィメーター，リミティドライアビリティカンパニー,516272836
ヨンウーカンパニー，リミテッド,515033496
ライオン株式会社,000006769
ライシオニュートリションリミティド,508291892
ライジェルファーマシューティカルズ，インコーポレイテッド,504294145
ライターインゴルスタドトゲーエムベーハー,509120344
ライトメディカルテクノロジーインコーポレイテッド,504154126
ライナットニューロサイエンスコーポレイション,505129415
ライフテクノロジーズコーポレーション,502221282
ライブリーフ，インコーポレーテッド,513275861
ラインストリームテクノロジーズ,512264806
ラグゼクレタエルエルシー,516213943
ラジェンドラン、ラジャ、ラマヌジャム,516282352
ラトガーズ，ザステイトユニバーシティオブニュージャージー,502155611
ラピスセミコンダクタ株式会社,308033711
ラピッドオーソドンティックス、インク．,516242275
ラフール・ラウト,516197274
ラボラトリースキンケアインコーポレイテッド,500535622
ラボラトワール・フランセ・デュ・フラクシオンマン・エ・デ・ビョテクノロジー,506129544
ラムリサーチコーポレーション,592010081
ランクセス・ドイチュランド・ゲーエムベーハー,505422707
ラヴァルエイ．シー．エス．リミテッド,514240644
リープヘル−コンポーネンツビーベラッハゲーエムベーハー,512197434
リープヘル−フェアツァーンテヒニクゲゼルシャフトミットベシュレンクテルハフツング,594012634
リケンテクノス株式会社,000250384
リコーイメージング株式会社,311015207
リサーチインスティチュートアットネイションワイドチルドレンズホスピタル,515289842
リサーチインスティチュートオブインダストリアルサイエンスアンドテクノロジー,592000705
リシー・エアロスペース,513128349
リジェネロン・ファーマシューティカルズ・インコーポレイテッド,597160510
リジュアンチェン,516257811
リセラ・コーポレイション,513146103
リチャージャブルバッテリーコーポレイション，ディー／ビー／エーアールビーシーテクノロジーズ,516238577
リドーマシーナリーインコーポレイテッド,512132505
リナックエー／エス,594167956
リニアーテクノロジーコーポレイション,593219551
リフラクトリー・インテレクチュアル・プロパティー・ゲー・エム・ベー・ハー・ウント・コ・カーゲー,503069193
リュー，デイヴィッド，エル．,514140746
リンテック株式会社,000102980
リンデアクチエンゲゼルシャフト,391009659
リンナイ株式会社,000115854
ルアク・シュヴァイツ・アクチェンゲゼルシャフト,512265009
ルオダファーマピーティーワイリミテッド,514290133
ルネサスエレクトロニクス株式会社,302062931
ルノーエス．ア．エス．,507308902
レームゲー・エム・ベー・ハー,516049733
レイクスウニフェルジテイト・フローニンゲン,504018105
レイセオンカンパニー,503455363
レイトンソーラーインコーポレイテッド,516248613
レイベン・テクノロジーズ・（ホンコン・）リミテッド,516135911
レインツデッチタングスゲーエムベーハー,505467753
レスメド・リミテッド,500046450
レッドニーインコーポレイテッド,516257969
レベルスリーコミュニケーションズ，エルエルシー,508140877
レボリューションディスプレイ，エルエルシー,514025867
レミントンデザインズリミテッドライアビリティカンパニー,314004336
レラボラトワールセルヴィエ,500287019
レリオンプラズマゲーエムベーハー,515198669
ローズマウントインコーポレイテッド,597115727
ローディアオペレーションズ,508079739
ローデンストック．ゲゼルシャフト．ミット．ベシュレンクテル．ハフツング,503279013
ロードウェアーズインコーポレイテッド,516219370
ローベルトボッシュゲゼルシャフトミットベシュレンクテルハフツング,501125231
ローベルトボツシユゲゼルシヤフトミツトベシユレンクテルハフツング,390023711
ローム・アンド・ハース・エレクトロニック・マテリアルズ・コリア・リミテッド,509266480
ロームアンドハースエレクトロニックマテリアルズエルエルシー,591016862
ロームアンドハースエレクトロニックマテリアルズシーエムピーホウルディングスインコーポレイテッド,504089426
ロームアンドハースカンパニー,590002035
ローム株式会社,000116024
ローランドディー．ジー．株式会社,000116057
ロイコケア・アクチェンゲゼルシャフト,508329885
ロウ、デイビッドエイ．,516267119
ロケットフレール,591169401
ロゼッタゲノミクスリミテッド,513243963
ロッキードマーティンコーポレーション,504242618
ロックウッドリチウムゲゼルシャフトミットベシュレンクテルハフツング,513159239
ロッターマーティンジェイ．,516283441
ロッテコンフェクショナリーカンパニーリミテッド,501401593
ロディアオペレーションズ,508076598
ロベルト・ボッシュ・ゲゼルシャフト・ミト・ベシュレンクテル・ハフツング,591245473
ロマークラボラトリーズエル．シー．,507337865
ロレアル,391023932
ロンザリミテッド,391003864
ロヴィガイズ，インコーポレイテッド,514320050
ワールプール・エシ・ア,506198746
ワイルドアンドリューマイケル,516182410
ワイルドクレアキャサリン,516182421
ワイルドジェニファーアリソン,516182409
ワイルドテレサキャスリーン,516182443
ワイルドハリエットビクトリア,516182432
ワルトシラネザーランズベーフェー,515103423
ヴァーサパワーシステムズリミテッド,516282927
ヴァーシテック・リミテッド,516259217
ヴァリアンセミコンダクターイクイップメントアソシエイツインコーポレイテッド,500239188
ヴァレオ、オートシステミ、エスピー．ゼット．オー．オー．,514111355
ヴァレオアンブラヤージュ,503041177
ヴァレオシステムデシュヤージュ,512092737
ヴァレオシステムデシュヤージュ,590003744
ヴァローレックドイチュラントゲーエムベーハー,513314366
ヴァンダファーマシューティカルズインコーポレイテッド,507021702
ヴアブコ・ゲゼルシヤフト・ミツト・ベシユレンクテル・ハフツング,596055475
ヴィゴラスソリューションズリミテッド,516276041
ヴィンタートゥールガスアンドディーゼルアーゲー,515111358
ヴェーエムイーホーランドベー．ヴェー．,595090635
ヴェステルホルト，マリアンネハーラー,516212669
ヴェリリーライフサイエンシズエルエルシー,516035068
ヴェルサリスソシエタペルアチオニ,512115977
ヴェルセック・エスペエルエル,516216058
愛愛送社株式会社,512266604
愛三工業株式会社,000116574
愛知機械工業株式会社,390009896
愛知製鋼株式会社,000116655
旭モールディング株式会社,503271969
旭化成エレクトロニクス株式会社,303046277
旭化成ファーマ株式会社,303046299
旭化成ホームズ株式会社,303046244
旭化成株式会社,000000033
旭硝子株式会社,000000044
旭陽化学工業株式会社,595033975
安藤敏文,512277404
伊東電機株式会社,592026819
井関農機株式会社,000000125
井尻正裕,715000027
井村屋グループ株式会社,390014904
一般財団法人ＮＨＫエンジニアリングシステム,591053926
一般財団法人電力中央研究所,000173809
一般財団法人日本消防設備安全センター,300035445
茨木宏治,715008403
因幡電機産業株式会社,000119830
宇田川明美,515284537
宇部マテリアルズ株式会社,000119988
宇部興産株式会社,000000206
臼井国際産業株式会社,000120249
永朔實業有限公司,514267984
塩野義製薬株式会社,000001926
横河電機株式会社,000006507
横浜エレベータ株式会社,594052700
横浜ゴム株式会社,000006714
王子ホールディングス株式会社,000122298
岡潔,514138721
岡部大陸,301033363
沖電気工業株式会社,000000295
加藤優子,515284685
嘉陽美幸,501069658
花王株式会社,000000918
華為技術有限公司,503433420
会津富士加工株式会社,511024931
海爾集団公司,512127855
学校法人加計学園,599035627
学校法人関西学院,503092180
学校法人関西大学,399030060
学校法人幾徳学園,391022614
学校法人久留米大学,599045903
学校法人近畿大学,000125347
学校法人慶應義塾,899000079
学校法人産業医科大学,506087705
学校法人自治医科大学,505246789
学校法人順天堂,502285457
学校法人新潟科学技術学園,505111982
学校法人千葉工業大学,598163064
学校法人早稲田大学,899000068
学校法人大阪医科薬科大学,502437894
学校法人東海大学,000125369
学校法人東京女子医科大学,591173198
学校法人東京農業大学,598096991
学校法人東洋大学,501061319
学校法人同志社,503027931
学校法人日本大学,899000057
学校法人北里研究所,598041566
学校法人名城大学,599002043
学校法人龍谷大学,597065329
楽天株式会社,399037405
株式会社ＡＤＥＫＡ,000000387
株式会社ＡＮＳｅｅＮ,516088329
株式会社ＣＳソリューション,513040432
株式会社Ｃｌｕｅｓ,515282681
株式会社ＤＮＰファインケミカル,000183923
株式会社Ｄブランド,515267769
株式会社Ｆ・Ｍ・Ｓ,514051040
株式会社ＦＯＭＭ,313017322
株式会社ＦｉＮＣ,514043735
株式会社Ｇ・Ｔ・Ｒ,509148072
株式会社ＧＢＲＹ,516147545
株式会社ＧＦＬ,513119303
株式会社ＧＳユアサ,507151526
株式会社ＩＨＩ,000000099
株式会社ＩＨＩエアロスペース,500302552
株式会社ＪＯＬＥＤ,514188173
株式会社ＪＶＣケンウッド,308036402
株式会社ＫＣＭ,509241041
株式会社ＫＲＩ,591167430
株式会社Ｋｙｕｌｕｘ,516003621
株式会社ＬＩＸＩＬ,302045705
株式会社ＬＴＴバイオファーマ,303010452
株式会社ＬｉｓＢ,511098013
株式会社ＭＯＲＥＳＣＯ,000146180
株式会社ＭＴＧ,599083411
株式会社Ｍｕｒａｋｕｍｏ,301014269
株式会社ＮＩＳＨＩＨＡＲＡ,508333033
株式会社ＮＴＴドコモ,392026693
株式会社ＮＴＴファシリティーズ,593063161
株式会社ＮｅｊｉＬａｗ,511025411
株式会社ＰＦＵ,000136136
株式会社Ｑｕａｒｒｙｍｅｎ＆Ｃｏ．,512139205
株式会社ＳＣＲＥＥＮセミコンダクターソリューションズ,506322684
株式会社ＳＣＲＥＥＮホールディングス,000207551
株式会社ＳＩＤ創研,312011419
株式会社ＳＵＭＣＯ,302006854
株式会社Ｔ＆ＫＴＯＫＡ,592215435
株式会社ＴＡＮ−ＥＩ−ＳＹＡ,507108313
株式会社ＴＢＫ,000220712
株式会社ＴＲＹセル,515266016
株式会社ＵＡＣＪ,000107538
株式会社ＷＯＷＯＷ,594058230
株式会社ＷＯＷＯＷコミュニケーションズ,515267895
株式会社ＷａｖｅＥｎｅｒｇｙ,512231417
株式会社ｅ−Ｊｕｎｃｔｉｏｎ,511256200
株式会社ｎｉｔｔｏｈ,000227364
株式会社いうら,394006129
株式会社すとろーはうす,506422342
株式会社ろけっと開発,513087781
株式会社アートネイチャー,000126218
株式会社アールテック,502094572
株式会社アールテック・ウエノ,592060271
株式会社アイエイアイ,391008515
株式会社アイサク,597066452
株式会社アシックス,000000310
株式会社アセラ,503353025
株式会社アドバンテスト,390005175
株式会社アドヴィックス,301065892
株式会社アニモ,595061705
株式会社アプライド・ビジョン・システムズ,504454060
株式会社アマダホールディングス,390014672
株式会社アモーレパシフィック,506213681
株式会社アルバック,000231464
株式会社イギス,510199502
株式会社イシダ,000147833
株式会社イノアックコーポレーション,000119232
株式会社イルカカレッジ,302036529
株式会社ウェルキャット,390035884
株式会社エーエヌエンジニアリング,510138877
株式会社エーピーアイコーポレーション,396020464
株式会社エーユー,315007433
株式会社エクセディ,000149033
株式会社エスエヌジー,314001771
株式会社エスプランニング,508336894
株式会社エトヴォス,508103023
株式会社エヌ・ティー・エス,504318326
株式会社エフ・アイ・ティ,310017378
株式会社エフ・シー・シー,000128175
株式会社エム・システム技研,390001166
株式会社オーディオテクニカ,000128566
株式会社オートネットワーク技術研究所,395011665
株式会社オギタヘムト,503322814
株式会社オトデザイナーズ,506191965
株式会社オハラ,000128784
株式会社オプティム,500521522
株式会社カカオ,514002422
株式会社カズマ,395003648
株式会社カタリナ,515268881
株式会社カネカ,000000941
株式会社カネコ,000104216
株式会社キーレックス,590000721
株式会社クボタ,000001052
株式会社クボタケミックス,505142964
株式会社クラレ,000001085
株式会社クレハ,000001100
株式会社グリーン＆ライフ・イノベーション,515177653
株式会社グロリアス,514300395
株式会社ケー・ユー技研,515265606
株式会社ケアコム,591253593
株式会社コシダカホールディングス,511043437
株式会社コスメック,391003989
株式会社コマツ,398000646
株式会社コロナ,000000538
株式会社コロプラ,509070463
株式会社コンテック,592007601
株式会社サイバー・ソリューションズ,501175281
株式会社サクラクレパス,390039734
株式会社サクラメン,308000218
株式会社サムソン,000130651
株式会社サンリツ,599024001
株式会社シーエンジ,300054206
株式会社システムズ,500303571
株式会社シミズオクト,503404648
株式会社ショーワ,000146010
株式会社シルフィード,512171157
株式会社ジーシー,000181217
株式会社ジーシーデンタルプロダクツ,000181228
株式会社ジェイテクト,000001247
株式会社ジオクリエイツ,513217311
株式会社ジャパンクリニカルサービス,513241626
株式会社ジャパンディスプレイ,502356528
株式会社ジョイコシステムズ,501468770
株式会社スカイロボット,515027772
株式会社スギノマシン,000132161
株式会社スギヤマゲン,598039242
株式会社スクウェア・エニックス,308033283
株式会社スリーボンド,000132404
株式会社セガゲームス,000132471
株式会社セルシード,501345220
株式会社ゼンリンデータコム,500578216
株式会社ソシオネクスト,514315159
株式会社ソディック,000132725
株式会社ソニー・インタラクティブエンタテインメント,310021766
株式会社ソフイア,000132747
株式会社ソフセラ,509090601
株式会社タイカ,306026980
株式会社タカトリ,000132954
株式会社タダノ,000148759
株式会社タニガキ建工,502270051
株式会社タニタ,000133179
株式会社タンガロイ,000221144
株式会社ダイセル,000002901
株式会社ダイゾー,391021031
株式会社ダイヘン,000000262
株式会社テクノクラーツ,302067947
株式会社テクノリンク,594206093
株式会社テック・エキスパーツ,502196463
株式会社テムコジャパン,591075892
株式会社ディスコ,000134051
株式会社ディッグ,515267507
株式会社デュプロ,000109727
株式会社デンソー,000004260
株式会社デンソーウェーブ,501428545
株式会社トクヤマ,000003182
株式会社トップ,390029676
株式会社トプコン,000220343
株式会社トリケミカル研究所,591006003
株式会社ナム,392004945
株式会社ニコン,000004112
株式会社ニコン・トリンブル,303047872
株式会社ニッキ,000153122
株式会社ニフコ,000135209
株式会社ニューギン,000135210
株式会社ニレコ,000135254
株式会社ネオス,000135265
株式会社ノーリツ,000004709
株式会社ノエビア,000135324
株式会社ノリタケカンパニーリミテド,000004293
株式会社ハーマン,301071893
株式会社ハイレックスコーポレーション,390000996
株式会社バッファロー,390040187
株式会社バンダイ,000135748
株式会社バンダイナムコエンターテインメント,000134855
株式会社パイオラックス,000124096
株式会社ビームセンス,505018740
株式会社ファーマフーズ,500101243
株式会社フィールドシステム,502441950
株式会社フジキン,390033857
株式会社フジクラ,000005186
株式会社フジシール,313004403
株式会社フジタ,302060926
株式会社フジミインコーポレーテッド,000236702
株式会社フジワラテクノアート,000223931
株式会社フロンティアエンジニアリング,000136642
株式会社ブイ・テクノロジー,500171707
株式会社ブリヂストン,000005278
株式会社ヘリオス,513229509
株式会社ベネフィット−イオン,515266429
株式会社マエダマテリアル,502074208
株式会社マキタ,000137292
株式会社マグマスパジャパン,506082766
株式会社マルナカ,304065879
株式会社マンダム,390011442
株式会社ミツトヨ,000137694
株式会社ミツバ,000144027
株式会社ミヤコシ,000161057
株式会社メイコー,000243906
株式会社メイワパックス,390033868
株式会社メジャーテックツルミ,508216404
株式会社メディカルプロジェクト,599135178
株式会社メドレックス,302005628
株式会社メニコン,000138082
株式会社ユニバーサルエンターテインメント,598098526
株式会社ユピテル,391001848
株式会社ユピテル鹿児島,508320239
株式会社ユポ・コーポレーション,000122313
株式会社ライフ,592132730
株式会社リケン,000139023
株式会社リコー,000006747
株式会社レーベン販売,302045602
株式会社レールテック,597110995
株式会社レベルファイブ,515265938
株式会社ロッテ,307013857
株式会社ワコー,390013343
株式会社ワコール,306033379
株式会社ワコム,000139403
株式会社ヴァレオジャパン,500309126
株式会社安川電機,000006622
株式会社安藤・間,303057365
株式会社荏原製作所,000000239
株式会社横河ブリッジ,508036743
株式会社岡崎製作所,000140454
株式会社岡村製作所,000000561
株式会社沖データ,591044164
株式会社河合楽器製作所,000001410
株式会社丸ヱム製作所,502262654
株式会社技研製作所,000141521
株式会社光栄,599008919
株式会社工販,501292795
株式会社工房ＰＤＡ,503304441
株式会社弘輝,000143215
株式会社高尾,395018239
株式会社根本杏林堂,391039313
株式会社鷺宮製作所,000143949
株式会社三共,000144153
株式会社三谷バルブ,000144463
株式会社三徳,000176660
株式会社三洋物産,000144522
株式会社資生堂,000001959
株式会社芝浦電子,000145242
株式会社重松製作所,000145507
株式会社小糸製作所,000001133
株式会社小松製作所,000001236
株式会社小森コーポレーション,000184735
株式会社松永製作所,000146113
株式会社松田製作所,515026982
株式会社湘南合成樹脂製作所,592057385
株式会社新川,000146722
株式会社森川金型製作所,510151201
株式会社神戸製鋼所,000001199
株式会社神鋼環境ソリューション,000192590
株式会社神崎高級工機製作所,000125853
株式会社川島製作所,000148162
株式会社浅野研究所,304050369
株式会社総合車両製作所,712004783
株式会社村田製作所,000006231
株式会社大一商会,000148922
株式会社大協精工,000149000
株式会社大阪ソーダ,000108993
株式会社大都技研,597044139
株式会社大友製作所,302030985
株式会社大林組,000000549
株式会社辰巳菱機,391028328
株式会社竹中工務店,000003621
株式会社椿本バルクシステム,000150811
株式会社島津製作所,000001993
株式会社東海理化電機製作所,000003551
株式会社東郷製作所,000151597
株式会社東芝,000003078
株式会社東北テクノアーチ,899000035
株式会社東洋高圧,592148878
株式会社東洋精機製作所,000151852
株式会社湯山製作所,592246705
株式会社藤商事,391010943
株式会社童夢,391021329
株式会社奈良機械製作所,000152181
株式会社日清製粉グループ本社,000226998
株式会社日本アルファ,392028767
株式会社日本エイピーアイ,595115754
株式会社日本スペリア社,592025786
株式会社日本ピージーエム,599027242
株式会社日本自動車部品総合研究所,000004695
株式会社日本触媒,000004628
株式会社日本総合研究所,302064762
株式会社日立システムズ,000233491
株式会社日立ハイテクノロジーズ,501387839
株式会社日立ビルシステム,000232955
株式会社日立国際電気,000001122
株式会社日立産機システム,502129933
株式会社日立産業制御ソリューションズ,000153443
株式会社日立情報通信エンジニアリング,000233295
株式会社日立製作所,000005108
株式会社巴川製紙所,000153591
株式会社八光,000153823
株式会社半導体エネルギー研究所,000153878
株式会社美登,515206768
株式会社筆まめ,311008863
株式会社不二工機,391002166
株式会社富士セラミックス,000154196
株式会社富士通ゼネラル,000006611
株式会社平和,000154679
株式会社別川製作所,505384449
株式会社豊成産業,591250776
株式会社豊田自動織機,000003218
株式会社豊田中央研究所,000003609
株式会社牧野フライス製作所,000154990
