キューティスファーマインコーポレーテッド,516276096
キュービーディー（キューエス−アイピー）リミテッド,516238625
キューリググリーンマウンテンインク,510244673
キユーピー株式会社,000001421
キョーユー株式会社,510031202
キンバリークラークワールドワイドインコーポレイテッド,310007106
ギガコリアコーリミテッド,516168919
ギガフォトン株式会社,300073919
ギャズトランスポルトエテクニギャズ,515220317
クールテック・アプリケーションズ,515013465
クアルコム，インコーポレイテッド,507364838
クアンタムサインアクイジションズインコーポレイテッド,516202028
クイーンマリーユニバーシティオブロンドン,512316611
クゥアルコム・インコーポレイテッド,595020643
クスワミインク,516124502
クヌドイェプスンアクティーゼルスカブ,516222554
クボタ機工株式会社,593207846
クマールサイン，アジェイ,516223274
クミアイ化学工業株式会社,000000169
クラトスインテグラルホールディングス，エルエルシー,515072521
クラリアント・インターナシヨナル・リミテツド,596081005
クラリオン株式会社,000001487
クラレノリタケデンタル株式会社,301069384
クラレプラスチックス株式会社,000104906
クリアフロー，インコーポレイテッド,516245863
クリスタル・ラグーンズ（キュラソー）ビー．ブイ．,513244122
クリニカルジェノミクスピーティーワイリミテッド,508346033
クルーシブルインテレクチュアルプロパティエルエルシー,512176727
クルナ・インコーポレーテッド,511085219
クレイトン・ポリマーズ・ユー・エス・エル・エル・シー,510145211
クロージヤー・システムズ・インターナシヨナル・インコーポレーテツド,505279259
クローズド・ジョイント・ストック・カンパニー“バイオキャド”,516261966
クロムニゴンアーベー,516178147
クワドリガバイオサイエンシーズ，インコーポレイテッド,516233011
グーグルインコーポレイテッド,502208397
グァンドンオッポモバイルテレコミュニケーションズコーポレーションリミテッド,516227559
グアラパックエッセ．ピー．アー．,512039053
グアンドンミデアキッチンアプライアンスマニュファクチュアリングカンパニーリミテッド,516096438
グラクソグループリミテッド,397009934
グラスウォール・（アイピー）・リミテッド,516099266
グランド・アビス・エルエルシー,516088097
グリーンファイア・エナジー・インコーポレイテッド,516268312
グリー株式会社,504437801
グリュネンタール・ゲゼルシャフト・ミト・ベシュレンクテル・ハフツング,390035404
グレインフラックインコーポレイテッド,516251093
グレンマークファーマシューティカルズ，エセ．アー．,510168852
グローブイミューン，インコーポレイテッド,505226437
グローリーＡＺシステム株式会社,501079875
グローリー株式会社,000001432
グンジ株式会社,593227866
ケーエルエー−テンカー・コーポレーション,502442049
ケーエルエー−テンカーコーポレイション,500049141
ケアベイ・ヨーロッパ・リミテッド,513186729
ケイシークカンパニーリミテッド,515129191
ケネスルコ,516208400
ケモマブリミテッド,516262000
ケラー，ザサード，ウォルタージョン,516266710
ケラー・トビアス,516261003
ゲーニウスゲーエムベーハー,513272239
ゲノエルエルシー,509262655
コーセラ，インコーポレーテッド,510301987
コーデックスシステムズ，インコーポレーテッド,516273268
コーニンクラケダウエグバートビー．ブイ．,512164779
コーニンクレッカフィリップスエヌヴェ,590000248
コーニングインコーポレイテッド,397068274
コーマトリックスカーディオバスキュラー，インコーポレイテッド,513051391
コールドスプリングハーバーラボラトリー,504278156
コーロンインダストリーズインク,314003797
コーロンファッションマテリアルインコーポレイテッド,515257911
コスモ株式会社,591176661
コスモ精工株式会社,503067683
コスモ石油株式会社,000105567
コッサンエスディーエヌ．ビーエイチディー．,510112981
コナミゲーミングインコーポレーテッド,501405122
コニカミノルタラボラトリーユー．エス．エー．，インコーポレイテッド,507031918
コニカミノルタ株式会社,000001270
コニンクリーケ・ケイピーエヌ・ナムローゼ・フェンノートシャップ,504292093
コネクサスレンズインコーポレイテッド,317000809
コヒラス・バイオサイエンシズ・インコーポレイテッド,514097509
コベストロ、ドイチュラント、アクチエンゲゼルシャフト,515266223
コミサリヤ・ア・レネルジ・アトミク・エ・オ・エネルジ・アルテルナテイブ,311015001
コミッサリアアレネルジーアトミークエオゼネルジザルタナテイヴ,502124444
コミッショング、ジェラルド,516267094
コモンウェルスサイエンティフィックアンドインダストリアルリサーチオーガナイゼーション,590003283
コリアインスティチュートオブジオサイエンスアンドミネラルリソースズ,506081530
コリアユニバーシティリサーチアンドビジネスファウンデーション,510273880
コリアリサーチインスティチュートオブケミカルテクノロジー,513201538
コリウムインターナショナル，インコーポレイテッド,503360296
コルヴィアメディカルインコーポレイテッド,511262418
コレボンアーベー,515332355
コンステリウムイソワール,500092697
コンティテミックマイクロエレクトロニックゲゼルシャフトミットベシュレンクテルハフツング,503355292
コンバテック・テクノロジーズ・インコーポレイテッド,509146126
コヴィディエンリミテッドパートナーシップ,512269650
ゴーゴー・エルエルシー,506194210
サーカッシアリミテッド,509330965
サーキットセラピューティクス，インコーポレイテッド,515138470
サーナ・セラピューティクス・インコーポレイテッド,500203684
サーモス株式会社,591261602
サイエンティスト・オブ・フォーチュン・ソシエテ・アノニム,513099094
サイデックス・ファーマシューティカルズ・インコーポレイテッド,501278788
サイトクローマ・デベロップメント・インコーポレイテッド,512014728
サイマベイ・セラピューティクス・インコーポレイテッド,514114611
サウジアラビアンオイルカンパニー,316017181
サウジアラビアンオイルカンパニー,506018363
サウジアラビアンオイルカンパニー,599130449
サウスダコタステートユニバーシティー,509352152
サザンミルズインコーポレイテッド,505451040
サソール・パーフオーマンス・ケミカルズ・ゲゼルシヤフト・ミツト・ベシユレンクテル・ハフツング,516219510
サッポロビール株式会社,303040183
サッポロホールディングス株式会社,000002196
サノフィ−アベンティス・ドイチュラント・ゲゼルシャフト・ミット・ベシュレンクテル・ハフツング,397056695
サノフイ,504456798
サビックグローバルテクノロジーズベスローテンフェンノートシャップ,508171804
サフラン・トランスミッション・システムズ,516247122
サミー株式会社,390031783
サミュメッドリミテッドライアビリティカンパニー,512265331
サムスンエレクトロニクスカンパニーリミテッド,503447036
サムスンプレシジョンインダストリアルカンパニーリミテッド,506329764
サムスンペイ、インコーポレイテッド,515234749
サムソンエレクトロ−メカニックスカンパニーリミテッド．,594023722
サムテック・イノベーションズ株式会社,511158018
サムヤンコーポレーション,515261354
サルヴァニーニイタリアエッセ．ピ．ア．,507385752
サン−ゴバンイゾベール,502425053
サン−ゴバングラスフランス,512212885
サン−ゴバンサントルドレシェルシュエデテュドユーロペアン,511104875
サンエヴァメディカル，インコーポレーテッド,516275848
サンガテクノロジー合同会社,515268135
サンケン電気株式会社,000106276
サンコ・インク・カンパニー・リミテッド,516272984
サンスター株式会社,000106324
サントリー食品インターナショナル株式会社,313000128
サントル・ナショナル・ドゥ・ラ・ルシェルシュ・シャンティフィク,595040744
サントルナシオナルドゥラルシェルシェシアンティフィク,311016455
サントレナティオナルドラルシェルシェシアンティフィク,514255523
サンドラムファスナーズリミテッド,516071572
サンドヴィックマテリアルズテクノロジードイチュラントゲーエムベーハー,515157459
サンノプココリアリミテッド,516263960
サンパテントトラスト,316002062
サンパワーコーポレイション,505379467
サヴィッド・セラピューティックス株式会社,514207197
サヴロックリミテッド,515191224
ザ・カウンシル・オヴ・ザ・クイーンズランド・インスティテュート・オヴ・メディカル・リサーチ,504200892
ザ・スウォッチ・グループ・リサーチ・アンド・ディベロップメント・リミテッド,506425538
ザ・トラステイーズ・オブ・ザ・ユニバーシテイ・オブ・ペンシルベニア,502409813
ザ・ブロード・インスティテュート・インコーポレイテッド,515236259
ザ・ボーイング・カンパニー,500520743
ザ・リージェンツ・オブ・ザ・ユニバーシティー・オブ・カリフォルニア,592034548
ザガバニングカウンシルオブザユニバーシティオブトロント,516204583
ザジェネラルホスピタルコーポレイション,506286973
ザジェネラルホスピタルコーポレイション,592017633
ザジョンズホプキンスユニバーシティ,508280195
ザップテックアイピーアクティーゼルスカブ,516267463
ザトラスティーズオブザユニバーシティオブペンシルバニア,500429103
ザブリガムアンドウィメンズホスピタルインコーポレイテッド,503146324
ザプロクターアンドギャンブルカンパニー,590005058
ザボードオブリージェンツオブザユニバーシティーオブテキサスシステム,508152917
ザユナイテッドステイツオブアメリカ，アズリプレゼンテッドバイザセクレタリー，デパートメントオブヘルスアンドヒューマンサービシーズ,508285606
ザユニバーシティーオブクイーンズランド,505167565
ザユニバーシティーオブメルボルン,500074981
ザユニバーシティオブウェスタンオーストラリア,504206827
ザユニバーシティオブクィーンズランド,503319102
ザユニバーシティオブミネソタ，デパートメントオブバイオプロダクツアンドバイオシステムズエンジニアリング,511246197
ザリージェンツオブザユニバーシティオブカリフォルニア,506115514
ザリージェンツオブザユニバーシティオブミシガン,507238218
シー・イー・エフ・オーカンパニー，リミテッド,516269478
シージェイチェイルジェダンコーポレイション,514158497
シーダーズ―シナイメディカルセンター,513268380
シートゥー・セラピューティクス・インコーポレイテッド,511123669
シーメンス・ヘルスケア・ダイアグノスティックス・インコーポレーテッド,507269175
シーメンスアクチエンゲゼルシヤフト,390039413
シーメンスアクティエンゲゼルシャフト,508008865
シーメンスエナジーインコーポレイテッド,599078705
シーメンスプロダクトライフサイクルマネージメントソフトウェアーインコーポレイテッド,504438288
シールドティーエックス（ユーケー）リミテッド,516272320
シアラスインコーポレイテッド,516203900
シィ，ヅェン,516217527
シェフラーテクノロジーズアー・ゲーウントコー．カー・ゲー,515009952
シェンヂェンエクセレントテクノロジーカンパニーリミテッド,516139388
シスメックス株式会社,390014960
シチズン時計株式会社,000001960
シチズン電子株式会社,000131430
シックアイヴィピーエービー,504048696
シップアンドオーシャンインダストリーズアールアンドディーセンター,516286752
シナジーファーマシューティカルズインコーポレイテッド,509333575
シナプティヴメディカル（バルバドス）インコーポレイテッド,515255191
シプラ・リミテッド,511109180
シマンテックコーポレーション,501113353
シャープ株式会社,000005049
シャオミ・インコーポレイテッド,513309030
シャンハイインスティテュートオブマテリアメディカ、チャイニーズアカデミーオブサイエンスィズ,509011765
シュアファイアメディカル，インコーポレイティド,512144911
シュゾースマートアドバンストコーティングテクノロジーズカンパニーリミテッド,516182052
シュタイ・ヨン,516197296
シュタインビフラーオプトテヒニクゲーエムベーハー,501461966
シュナイダーエレクトリックアイティーコーポレーション,501439828
シュリーブケミカルプロダクツインコーポレーテッド,508029859
シュレーディンガーインコーポレイテッド,516189121
シュワルツ、ローレンスエム．,516267083
ショーンベックマリアム,516272906
ショットアクチエンゲゼルシャフト,504299782
シラナノテクノロジーズインク,513198814
シリコンストーリッジテクノロージーインコーポレイテッド,500147506
シロナ・デンタル・システムズ・ゲゼルシャフト・ミット・ベシュレンクテル・ハフツング,500058187
シンジェンタパーティシペーションズアーゲー,300091441
シンフィルムエレクトロニクスエーエスエー,514153274
シンフォニアテクノロジー株式会社,000002059
ジ・アンテナ・カンパニー・インターナショナル・エン・フェー,516196990
ジ・ディ・ソチエタペルアツィオニ,502405479
ジー・エフ・エス．コーポレーション．エー・ユー・エス．ピー・ティー・ワイ．エル・ティー・ディー,516281252
ジーアールエスガイドシステムインコーポレイテッド,516281171
ジーイー・アビエイション・システムズ・エルエルシー,506388923
ジーイー・ヘルスケア・バイオサイエンス・コーポレイション,598041463
ジーイー・メディカル・システムズ・グローバル・テクノロジー・カンパニー・エルエルシー,300019238
ジーエヌリザウンドエー／エス,503021401
ジーエム・グローバル・テクノロジー・オペレーションズ・エルエルシー,511095986
ジーティーシーテクノロジーユーエス，エルエルシー,511136887
ジーティーダブリューディヴェロップメンツリミテッド,516239909
ジアングスフーシェンバイオテクノロジー有限公司,515267862
ジェーアンドイーホールリミテッド,516155975
ジェイティーインターナショナルエス．エイ．,510014582
ジェイテクトユーロップ,511110625
ジェイピーエムエンジニアリング株式会社,516296658
ジェコス株式会社,000179915
ジェネラル・ケーブル・テクノロジーズ・コーポレーション,507202725
ジェネンテック，インコーポレイテッド,509012625
ジェノプランテ−ヴァロール,513099108
ジェノマティカ，インコーポレイテッド,510199890
ジェン−プローブ・インコーポレーテッド,500169900
ジェンサームインコーポレイテッド,511014862
ジェンザイム・コーポレーション,500034653
ジェンセルバイオシステムズリミテッド,513014477
ジエマルト・エス・アー,504326572
ジオサーフ株式会社,503148568
ジテアンテルナショナルソシエテアノニム,511087051
ジプトロニクス・インコーポレイテッド,502116003
ジャガーランドローバーリミテッド,512308720
ジャパンパイル株式会社,515277300
ジヤトコ株式会社,000231350
ジュン，ボスン,516174149
ジョージアテックリサーチコーポレイション,304017373
ジョン，ヘジン,516089913
ジョンソン、マッセイ、パブリック、リミテッド、カンパニー,590004718
ジョンソン、マッセイ、フュエル、セルズ、リミテッド,512269535
ジョンソン・アンド・ジョンソン・ビジョン・ケア・インコーポレイテッド,510294139
ジョンソンエレクトリックソシエテアノニム,515009620
ジョンソンコントロールズオートモーティブエレクトロニクスゲーエムベーハー,508039825
スーパーセルオーワイ,513136528
スイスオートパワースポーツエルエルシー,511281132
スカイプエス．アール．エル．,516259871
スカラブゲノミクス，エルエルシー,508314607
スガツネ工業株式会社,000107572
スクエアインコーポレイテッド,513092420
スズキ株式会社,000002082
スタースプリングスアクチボラグ,515200180
スタッカート・テクノロジーズ・アクチエボラグ,516248716
スタンレー電気株式会社,000002303
スチールプランテック株式会社,501120122
スティッチティングカソリークユニバーシテートラドバウドユニバーシティメディカルセンター,516203405
ステイブルセラピューティクスアーベー,516281126
ステップワイズエルティーディー,516281229
ステラファーマ株式会社,507288132
ステルスペプチドズインターナショナルインコーポレイテッド,512044909
ストライトインダストリーズエルティディ,513144969
ストロングアームテクノロジーズ、インク．,516282341
スナップトラック・インコーポレーテッド,500480274
スノーフレークコンピューティングインク．,516245999
スパイサーゲレンクヴェレンバウゲゼルシャフトミットベシュレンクテルハフツング,516178778
スパイナル・エレメンツ・インコーポレーテッド,506166653
スパインウェルディング・アクチェンゲゼルシャフト,511206559
スペクトラ・シュヴィングングステヒニーク・ウント・アクスティーク・ゲゼルシャフト・ミト・ベシュレンクテル・ハフツング・ドレスデン,516272869
スペクトロニクス株式会社,506161131
スペシャリストエアウェイソリューションズプロプライエタリーリミテッド,516384391
スポートウェルディング・ゲゼルシャフト・ミット・ベシュレンクテル・ハフツング,512193366
スマートゲンエルエルシー,516272892
スミスアンドネフューインコーポレーテッド,504048135
スミスアンドネフューインコーポレイテッド,502032219
スミスアンドネフューピーエルシー,391018787
スリーエムイノベイティブプロパティズカンパニー,505005049
スリーディーティーホールディングスエルエルシー,516229003
スローン−ケッタリングインスティチュートフォーキャンサーリサーチ,500516056
セーレン株式会社,000107907
セイコーエプソン株式会社,000002369
セオリアファーマ株式会社,510239598
セファロン、インク．,509021085
セミコンダクター・コンポーネンツ・インダストリーズ・リミテッド・ライアビリティ・カンパニー,300057230
セラニーズ・インターナショナル・コーポレーション,512225379
セルラー・ダイナミクス・インターナショナル・ジャパン株式会社,516378356
セレオンゲーエムベーハー,516265148
セレクティス,512213549
セレラコーポレーション,508356065
セント・ジュード・メディカル，カーディオロジー・ディヴィジョン，インコーポレイテッド,511177374
ゼットティーイー（ユーエスエー）インコーポレイテッド,510279365
ゼットティーイーコーポレーション,509024525
ゼットティーイーコーポレイション,511207729
ゼネラル・エレクトリック・カンパニイ,390041542
ゼネラルエレクトリックテクノロジーゲゼルシャフトミットベシュレンクテルハフツング,515322297
ゼネラル株式会社,306029349
ゼラスメディカルテクノロジーズエルエルシー,516272412
ゼロックスコーポレイション,596170170
ゼンコアインコーポレイテッド,510089100
ソーダストリームインダストリーズリミテッド,514032843
ソーラー・ジャンクション・コーポレイション,511314290
ソーラーフロンティア株式会社,513009668
ソーラーリティックスインコーポレイテッド,516247155
ソウルナショナルユニバーシティアールアンドディービーファウンデーション,513110089
ソシエテ・デンバラージュ・エ・ドゥ・コンディシオンヌモン・エス・ウ・エム・セ・オ,516281045
ソニーインタラクティブエンタテインメントアメリカリミテッドライアビリテイカンパニー,513244960
ソニーコーポレイションオブアメリカ,504257564
ソニー株式会社,000002185
ソニックアイピー，インコーポレイテッド,513280728
ソノコ・ディベロップメント・インコーポレーテッド,500119640
ソルベイスペシャルティポリマーズイタリーエス．ピー．エー．,513092877
ソルヴェイ（ソシエテアノニム）,591001248
ゾール・サーキュレイション・インコーポレイテッド,500087017
ゾールサーキュレイションインコーポレイテッド,314003041
ゾエティス・サービシーズ・エルエルシー,515230154
ゾディアックシーツフランス,513096624
ターボメカ,501107994
タイサコン・グループ・カンパニー・リミテッド,516148508
タイムプレイインク．,515336504
タイン・リサーチ・アンド・ディベロップメント・カンパニー・リミテッド,516272995
タカタ株式会社,306009581
タカハタプレシジョンジャパン株式会社,312003595
タカラベルモント株式会社,000108672
タカ産業株式会社,593045075
タキゲン製造株式会社,000108708
タタコンサルタンシーサービシズリミテッド,510337621
タツタ電線株式会社,000108742
タリスバイオメディカルエルエルシー,514274409
タレス,511148123
ダイキョーニシカワ株式会社,390026538
ダイキン工業株式会社,000002853
ダイコク電機株式会社,000108937
ダイソン・テクノロジー・リミテッド,500024469
ダイハツ工業株式会社,000002967
ダイヤテックス株式会社,390019264
ダウアグロサイエンシィズエルエルシー,501035309
ダウグローバルテクノロジーズエルエルシー,502141050
ダウコーニングコーポレーション,590001418
ダスギプ・インフォメーション・アンド・プロセス・テクノロジー・ゲゼルシャフト・ミット・ベシュレンクテル・ハフツング,514089249
ダブリュ．エル．ゴアアンドアソシエイツ，インコーポレイティド,391028362
ダンマークステクニスクユニバーシテット,511195736
チェ，テホ,516154576
チュージアンシェンフイライティングカンパニーリミテッド,514280525
チュルクウントヒリンガーゲーエムベーハー,516212843
チョーネンキー，トッドエリック,516266732
チルドレンズホスピタルロサンゼルス,514124573
ツェットエフ、フリードリッヒスハーフェン、アクチエンゲゼルシャフト,500045121
ツェットカーヴェーグループゲーエムベーハー,593045569
テーザ・ソシエタス・ヨーロピア,509120403
テーラーメイドゴルフカンパニーインコーポレイテッド,506025969
ティー・エイ・ジー・メディカル・ディバイシズ−アグリカルチャー・コーペラティブ・リミテッド,516221111
ティー２バイオシステムズ，インコーポレーテッド,511105894
